"1048","Comunidad de trabajadores de la salud (por cada 1.000 personas)",NA,NA,NA,NA,NA,NA,NA,NA,NA,NA,NA,NA
"1049","Niños (0-14) que viven con VIH",NA,NA,NA,NA,NA,NA,NA,NA,NA,NA,NA,NA
"1050","Mujeres adultas con VIH (% de la población mayores de 15 años con VIH)",NA,NA,NA,NA,NA,NA,NA,NA,NA,NA,NA,NA
"1051","Uso de preservativos, población entre 15-24 años, mujeres (% de mujeres entre 15-24 años)",NA,NA,NA,NA,NA,NA,NA,NA,NA,NA,NA,NA
"1052","Women Business and the Law Index Score (scale 1-100)",NA,NA,NA,NA,NA,NA,NA,NA,NA,NA,34.4,51.9
"1053","Educacin terciaria, profesores (% de mujeres)",NA,NA,NA,NA,NA,NA,NA,NA,NA,NA,NA,NA
"1054","Nivel de instrucción, al menos nivel de licenciatura o equivalente, población de más de 25 años, mujeres (%) (acumulativo)",NA,NA,NA,NA,NA,NA,NA,NA,NA,NA,NA,NA
"1055","Transición a la escuela secundaria (%)",NA,NA,NA,NA,NA,NA,NA,NA,NA,NA,NA,75.46999
"1056","Educación de nivel secundario, alumnos en programas de educación general",NA,NA,NA,NA,NA,NA,NA,NA,NA,NA,NA,182514
"1057","Edad de ingreso a la escuela secundaria (años)",NA,NA,NA,NA,NA,NA,NA,NA,NA,NA,12,12
"1058","Repetidores, escuela primaria, varones (% de varones inscriptos)",NA,NA,NA,NA,NA,NA,NA,NA,NA,NA,NA,12.79187
"1059","Inscripción escolar, nivel primario, mujeres (% neto)",NA,NA,NA,NA,NA,NA,NA,NA,NA,NA,NA,79.13283
"1060","Tasa de finalización de la educación de nivel primario, varones (% del grupo etario correspondiente)",NA,NA,NA,NA,NA,NA,NA,NA,NA,NA,NA,57.7647094726563
"1061","Tasa de alfabetización, total de adultos (% de personas de 15 años o más)",NA,NA,NA,NA,NA,NA,NA,NA,NA,NA,NA,NA
"1062","Cobertura de los programas de medidas de protección social en el quintil más rico (% de la población)",NA,NA,NA,NA,NA,NA,NA,NA,NA,NA,NA,NA
"1063","Cobertura de los programas de trabajo y protección social (% de la población)",NA,NA,NA,NA,NA,NA,NA,NA,NA,NA,NA,NA
"1064","Ingreso neto del extranjero (UMN a precios actuales)",-21619300,-25480000,-23842900,-17810200,-18934200,-2.5e+07,-25200000,-24900000,-27100000,-2.8e+07,-29200000,-35700000
"1065","Crecimiento del INB (% anual)",NA,4.75260778902806,4.94643260046963,2.76812755110889,7.56942211017547,3.05337916731727,-0.338677916876762,4.68221949617178,1.8171896404664,4.84415773161101,6.73259333606107,5.97646985363258
"1066","PIB per cápita (US$ a precios constantes de 2010)",2238.00944239002,2287.00553626265,2332.13521892776,2313.9994977498,2414.71884283993,2422.41103635473,2344.68385452423,2382.18238807987,2357.5170247449,2396.47753949908,2487.73327830352,2568.91863956243
"1067","Valor agregado bruto al costo de los factores (UMN a precios actuales)",1665948186.34508,1556087903.61598,1472385855.75902,1755055515.31159,2147133290.82059,2295715000,2326096000,2428768000,2452421000,2975593000,2722170000,2617297000
"1068","Ingreso nacional neto ajustado per cápita (US$ a precios actuals)",NA,NA,NA,NA,NA,NA,NA,NA,NA,NA,452.81539993742,422.283592927646
"1069","Ahorro ajustado: agotamiento neto de recursos forestales (% del INB)",NA,NA,NA,NA,NA,NA,NA,NA,NA,NA,0.337671476579552,0.409199137748048
"1070","Maquinaria y equipo de transporte (% del valor agregado en la industrialización)",NA,NA,NA,0,0.097278229042457,0.90278125,0.629620723705606,0.123586415949447,0.180623663115632,0.154577415199877,0.329561525956308,0.181488203266788
"1071","Financial intermediary services indirectly Measured (FISIM) (constant LCU)",NA,NA,NA,NA,NA,0,0,0,0,0,0,0
"1072","Importaciones de bienes y servicios (% del crecimiento anual)",NA,-0.696966722293226,11.1012257809414,-3.70139692143451,9.80319689550078,4.70380343318733,3.23699157833852,20.5453659155912,12.4747381780954,0.023109687684169,3.21481117563343,20.3877383317557
"1073","Formación bruta de capital fijo (US$ a precios constantes de 2010)",3472351422.75839,3586357396.01535,3404334299.73053,3507905827.97752,3696498760.00936,3807413045.85595,3848428953.04252,4530054768.20439,4797057811.12804,4940829387.10764,4928574882.43896,6163427863.11749
"1074","Deflactor del gasto nacional bruto (año base varía según el país)",19.2155970395838,17.1515919316064,15.5290487902186,18.2635284418956,21.0806213074872,21.7951174437203,22.0610123447806,21.9787619205566,21.6330060972609,24.9626660835457,21.5173334841773,19.5535180506767
"1075","Exportaciones de servicios comerciales (US$ a precios actuales)",NA,NA,NA,NA,NA,NA,NA,NA,NA,NA,NA,NA
"1076","Exportaciones de metales y minerales (% de las exportaciones de mercaderías)",NA,NA,0.165803128175728,0.319211424927585,0.375688054724061,0.291748165116568,0.242778418558436,0.322242050588541,0.239121160514478,0.49407408487481,0.554101033271851,0.630454944293069
"1077","Mercaderías importadas desde economías en desarrollo dentro de la región (% del total de mercaderías importadas)",2.47524752475248,2.30923694779116,5.29661016949153,12.8650355169692,8.45360824742268,10.7987181812685,5.62830232023892,12.6225375781906,7.03381869422264,11.5220895152292,11.4957639497517,13.5543051403786
"1078","Importaciones de bienes de tecnologías de la información y la comunicación (TIC) (% del total de importaciones de bienes)",NA,NA,NA,NA,NA,NA,NA,NA,NA,NA,NA,NA
"1079","Tasa arancelaria, nación más favorecida, media simple, todos los productos (%)",NA,NA,NA,NA,NA,NA,NA,NA,NA,NA,NA,NA
"1080","Turismo internacional, gastos (US$ a precios actuales)",NA,NA,NA,NA,NA,NA,NA,NA,NA,NA,NA,NA
"1081","Exhaustividad del registro de muertes con información sobre causa de muerte (%)",NA,NA,NA,NA,NA,NA,NA,NA,NA,NA,NA,NA
"1082","Tasa de inactividad por edades (% de la población en edad de trabajar)",92.6816308408262,93.5512616601648,94.7136383733001,95.8859480625681,96.6251608674607,96.7532937748921,97.0597005174831,96.7812183350151,96.0903909369321,95.2472912159754,94.3844968350822,93.9546815329435
"1083","Población de 50 a 64 años, varones (% de la población masculina)",2.2036192819989,2.17058216122296,2.14191117285261,2.11727771429586,2.09632323225988,2.07855147245477,2.04540743923575,2.01532717372554,1.99181218146879,1.97971215800386,1.98061846332571,1.97810512815037
"1084","Población de 20 a 24 años, varones (% de la población masculina)",8.15093475739012,8.18305710567943,8.23308534691572,8.28210941501606,8.30489879001137,8.28965831681288,8.21207330540458,8.09724352590266,7.99415852062272,7.97048918269028,8.05853184695609,8.22200343145239
"1085","Población entre 0 y 14 años de edad, hombres (% del total)",43.9316382302895,44.179884900629,44.5213258207425,44.872313897642,45.1107937853096,45.189950642252,45.3008498700792,45.2628604197203,45.1200671178322,44.9394119128126,44.7533989885896,44.6628102403005
"1086","Esperanza de vida al nacer, mujeres (años)",54.295,54.864,55.418,55.956,56.481,57,57.519,58.048,58.591,59.149,59.722,60.303
"1087","Volúmenes internacionales de migrantes (% de la población)",NA,NA,NA,NA,NA,NA,NA,NA,NA,NA,NA,NA
"1088","Proporción de jóvenes sin educación, empleo ni capacitación, mujeres (% de la población de mujeres jóvenes)",NA,NA,NA,NA,NA,NA,NA,NA,NA,NA,NA,NA
"1089","Población activa, total",NA,NA,NA,NA,NA,NA,NA,NA,NA,NA,NA,NA
"1090","Fuerza laboral con educación básica (% del total)",NA,NA,NA,NA,NA,NA,NA,NA,NA,NA,NA,NA
"1091","Niños económicamente activos, que sólo trabajan (% para cada edad de niños entre los 7 y 14 años)",NA,NA,NA,NA,NA,NA,NA,NA,NA,NA,NA,NA
"1092","Empleados de servicios, mujeres (% del empleo femenino)",NA,NA,NA,NA,NA,NA,NA,NA,NA,NA,NA,NA
"1093","PIB por cada persona empleada (a $ de PPA constantes de 2011)",NA,NA,NA,NA,NA,NA,NA,NA,NA,NA,NA,NA
"1094","Relación entre empleo y población, mayores de 15 años, varones (%) (estimación nacional)",NA,NA,NA,NA,NA,NA,NA,NA,NA,NA,NA,NA
"1095","Empleos en agricultura (% del total de empleos)",NA,NA,NA,NA,NA,NA,NA,NA,NA,NA,NA,NA
"1096","Multidimensional poverty headcount ratio, male (% of male population)",NA,NA,NA,NA,NA,NA,NA,NA,NA,NA,NA,NA
"1097","Participación en el ingreso del 20% mejor remunerado de la población",NA,NA,NA,NA,NA,NA,NA,NA,NA,NA,NA,NA
"1098","External health expenditure per capita (current US$)",NA,NA,NA,NA,NA,NA,NA,NA,NA,NA,NA,NA
"1099","Increase in poverty gap at $1.90 ($ 2011 PPP) poverty line due to out-of-pocket health care expenditure (% of poverty line)",NA,NA,NA,NA,NA,NA,NA,NA,NA,NA,NA,NA
"1100","Suicide mortality rate, female (per 100,000 female population)",NA,NA,NA,NA,NA,NA,NA,NA,NA,NA,NA,NA
"1101","Personas que practican la defecación al aire libre, sector urbano (% de la población urbana)",NA,NA,NA,NA,NA,NA,NA,NA,NA,NA,NA,NA
"1102","People using at least basic sanitation services, urban (% of urban population)",NA,NA,NA,NA,NA,NA,NA,NA,NA,NA,NA,NA
"1103","Número de muertes maternas",NA,NA,NA,NA,NA,NA,NA,NA,NA,NA,NA,NA
"1104","Incidence of HIV, all (per 1,000 uninfected population)",NA,NA,NA,NA,NA,NA,NA,NA,NA,NA,NA,NA
"1105","Mortalidad provocada por enfermedades cardiovasculares, cáncer, diabetes o enfermedades respiratorias crónicas entre las edades exactas de 30 y 70 años (%)",NA,NA,NA,NA,NA,NA,NA,NA,NA,NA,NA,NA
"1106","Número de muertes infantiles",23296,23220,23158,23117,23091,23092,23123,23177,23225,23251,23212,23059
"1107","Mujeres que creen que está justificado que un marido golpee a su esposa cuando descuida a los hijos (%)",NA,NA,NA,NA,NA,NA,NA,NA,NA,NA,NA,NA
"1108","Gasto por alumno, nivel secundario (% del PIB per cápita)",NA,NA,NA,NA,NA,NA,NA,NA,NA,NA,NA,NA
"1109","Nivel de instrucción, al menos nivel de maestría o equivalente, población de más de 25 años, varones (%) (acumulativo)",NA,NA,NA,NA,NA,NA,NA,NA,NA,NA,NA,NA
"1110","Maestros capacitados en el ciclo superior de la educación de nivel secundario, varones (% de maestros varones)",NA,NA,NA,NA,NA,NA,NA,NA,NA,NA,NA,NA
"1111","Inscripción escolar, nivel secundario (% bruto)",NA,NA,NA,NA,NA,NA,NA,NA,NA,NA,NA,25.5090293884277
"1112","Nivel de instrucción, al menos escuela de nivel posterior a la secundaria completa, población de más de 25 años, mujeres (%) (acumulativo)",NA,NA,NA,NA,NA,NA,NA,NA,NA,NA,NA,NA
"1113","Total de inscripciones, nivel primario (% neto)",NA,NA,NA,NA,NA,NA,NA,NA,NA,NA,NA,79.53869
"1114","Alumnos de mayor edad, nivel primario, (% de matrícula)",NA,NA,NA,NA,NA,NA,NA,NA,NA,NA,NA,16.93049
"1115","Educación de nivel primario, alumnos (% de mujeres)",NA,NA,NA,NA,NA,NA,NA,NA,NA,NA,NA,48.48577
"1116","Relación alumno-maestro, preescolar",NA,NA,NA,NA,NA,NA,NA,NA,NA,NA,NA,32.98561
"1117","Cobertura de los programas de seguro social en el cuarto quintil (% de la población)",NA,NA,NA,NA,NA,NA,NA,NA,NA,NA,NA,NA
"1118","Cobertura de los beneficios por desempleo y los ALMP en el cuarto quintil (% de la población)",NA,NA,NA,NA,NA,NA,NA,NA,NA,NA,NA,NA
"1119","Transferencias corrientes netas del extranjero (UMN a precios constantes)",NA,NA,NA,NA,NA,35633072,33921140,44713016,44677540,38931372,60277612,60706668
"1120","Crecimiento per cápita del INB (% anual)",NA,1.82784510761307,1.99982840413666,-0.134576701788916,4.51017325022445,0.103197951660675,-3.20784691519012,1.65867968566593,-1.12499343593781,1.82248645111859,3.67257005956367,2.95630013781071
"1121","Ahorro interno bruto (US$ a precios actuales)",517591264.563794,429140037.24511,367952980.209405,441560065.70263,523145527.237823,550311797.463232,528466325.617848,535736810.797624,399764631.173599,587720729.809041,457746425.326445,448639059.619619
"1122","PIB a precios de mercado: series vinculadas (UMN actual)",NA,NA,NA,NA,NA,NA,NA,NA,NA,NA,NA,NA
"1123","Exportaciones como capacidad para importar (UMN a precios constantes)",1254385984.74766,1193109361.08684,1425329835.21527,1341530145.06774,1393633804.45825,1451347558.48176,1619926453.52444,1738762935.99943,1846967064.21952,1636017633.60206,1744138315.01152,1834239345.08621
"1124","Ahorro ajustado: daño por emisión de partículas (US$ actuales)",NA,NA,NA,NA,NA,NA,NA,NA,NA,NA,NA,NA
"1125","Services, value added (constant 2010 US$)",5007822004.50728,5228894275.09896,5379232209.7114,5560389473.10743,6015252333.11233,6178888306.89555,6218720463.55599,6359988620.76121,6577016605.60883,6886604496.31884,7380398029.77151,7544618824.01408
"1126","Ahorro ajustado: consumo de capital fijo (% del INB)",NA,NA,NA,NA,NA,NA,NA,NA,NA,NA,2.65630870293474,2.53930856638606
"1127","Medium and high-tech Industry (including construction) (% manufacturing value added)",NA,NA,NA,NA,NA,NA,NA,NA,NA,NA,NA,NA
"1128","Industrialización, valor agregado (US$ a precios actuales)",407937996.006322,338551281.43458,295609578.649143,363303732.20235,482560094.90755,487026461.004347,532442231.508096,552678932.172926,547646519.835748,676144116.443658,663845220.845064,636045894.960208
"1129","Importaciones de bienes y servicios (% del PIB)",10.3640719922139,10.1516653685266,10.7943896253692,9.95697544232937,10.1444581483728,10.290481092282,11.114369199533,12.0315925734963,13.9182074148867,12.1023572054297,13.010025402533,16.6901086127357
"1130","Formación bruta de capital fijo (UMN a precios constantes)",2645667541.1084,2732531416.97117,2593843669.40723,2672757292.22493,2816450754.6691,2900959000,2932210000,3451557000,3654993000,3764536000,3755199000,4696063000
"1131","Gasto nacional bruto (UMN a precios actuales)",1730683361.85636,1622298292.00094,1509827973.57869,1818300896.1659,2272805453.71308,2417179000,2443410000,2601490000,2655172000,3222641000,2963240000,2921094000
"1132","Gasto de consumo final de los hogares (US$ a precios constantes de 2010)",6030710882.36791,6349658138.32071,6780136635.97776,6976519883.51096,7575699414.03361,7767468959.12221,7822039738.71291,8082166665.72501,8466812002.74366,8928106913.82716,9700100536.10369,10203647292.5253
"1133","Personal de las fuerzas armadas, total",NA,NA,NA,NA,NA,NA,NA,NA,NA,NA,NA,NA
"1134","Suscripciones a telefonía fija (por cada 100 personas)",NA,NA,NA,NA,NA,0.915336,0.915336,0.915336,0.915336,0.915336,1.48285,1.48285
"1135","Nivel general de la capacidad estadística (escala 0 - 100)",NA,NA,NA,NA,NA,NA,NA,NA,NA,NA,NA,NA
"1136","Calificación de la política fiscal de la CPIA (1=bajo a 6=alto)",NA,NA,NA,NA,NA,NA,NA,NA,NA,NA,NA,NA
"1137","Solicitudes de diseño industrial, personas no residentes, por recuento",NA,NA,NA,NA,NA,NA,NA,NA,NA,NA,NA,NA
"1138","Impuestos laborales y contribuciones (% de ganancias comerciales)",NA,NA,NA,NA,NA,NA,NA,NA,NA,NA,NA,NA
"1139","Tiempo para salir de la insolvencia (años)",NA,NA,NA,NA,NA,NA,NA,NA,NA,NA,NA,NA
"1140","Pérdidas por robo, asalto, vandalismo e incendio premeditado (% de ventas)",NA,NA,NA,NA,NA,NA,NA,NA,NA,NA,NA,NA
"1141","Cobertura de agencias de información privadas (% de adultos)",NA,NA,NA,NA,NA,NA,NA,NA,NA,NA,NA,NA
"1142","Primary government expenditures as a proportion of original approved budget (%)",NA,NA,NA,NA,NA,NA,NA,NA,NA,NA,NA,NA
"1143","Impuestos sobre la renta, las utilidades y las ganancias de capital (UMN a precios actuales)",NA,NA,NA,NA,NA,NA,NA,NA,NA,NA,NA,NA
"1144","Contribuciones sociales (% de la recaudación)",NA,NA,NA,NA,NA,NA,NA,NA,NA,NA,NA,NA
"1145","Account ownership at a financial institution or with a mobile-money-service provider, young adults (% of population ages 15-24)",NA,NA,NA,NA,NA,NA,NA,NA,NA,NA,NA,NA
"1146","Tasa de interés de los depósitos (%)",NA,NA,NA,NA,NA,NA,NA,NA,NA,NA,NA,NA
"1147","Total de reservas (% del total de la deuda externa)",NA,NA,NA,NA,NA,NA,NA,NA,NA,NA,NA,13.9674589819356
"1148","Extracción anual de agua dulce, total (en billones de metros cúbicos)",NA,NA,NA,NA,NA,NA,NA,NA,NA,NA,NA,NA
"1149","Población que vive en zonas donde la elevación es inferior a 5 metros (% de la población total)",NA,NA,NA,NA,NA,NA,NA,NA,NA,NA,NA,NA
"1150","Emisiones de gas SF6 (miles de toneladas métricas de equivalente de CO2)",NA,NA,NA,NA,NA,NA,NA,NA,NA,NA,NA,NA
"1151","Emisiones de metano en el sector de energía (miles de toneladas métricas de equivalente de CO2)",NA,NA,NA,NA,NA,NA,NA,NA,NA,0,1826.39021066189,1583.32438502635
"1152","Emisiones de CO2 (kg por US$ del PIB de 2010)",0.173455339147639,0.154022917501339,0.139608586086477,0.156901647712903,0.174402903910943,0.179264335447829,0.191171558574987,0.195740000616515,0.230921669663297,0.254362319466011,0.283665091631156,0.263216114902176
"1153","Producción de energía eléctrica renovable (% de la producción total de electricidad)",NA,NA,NA,NA,NA,NA,NA,NA,NA,NA,NA,NA
"1154","Servicio de la deuda pública y con garantía pública (% del INB)",NA,NA,NA,NA,NA,NA,NA,NA,NA,NA,0.942739936091864,1.32142852253557
"1155","Asistencia oficial para el desarrollo (AOD) neta y ayuda oficial neta recibidas (US$ constantes de 2013)",44419998.1689453,76489997.8637695,86750000,106389999.389648,118910003.662109,134490005.493164,153149993.896484,162330001.831055,136610000.610352,104480003.356934,113699996.948242,116889999.389648
"1156","Flujos financieros netos, concesionario de bancos de desarrollo regional (BDR) (NFL, US$ a precios actuales)",NA,NA,NA,NA,NA,NA,NA,NA,NA,NA,4639000,4271000
"1157","Flujos oficiales netos de organismos de las Naciones Unidas, Organización Internacional del Trabajo (OIT) (USD a precios actuales)",NA,NA,NA,NA,NA,NA,NA,NA,NA,NA,NA,NA
"1158","Deuda externa acumulada, a corto plazo (DOD, US$ a precios actuales)",NA,NA,NA,NA,NA,NA,NA,NA,NA,NA,1.06e+08,1.19e+08
"1159","Flujos de ayuda bilateral neta de donantes del Comité de Asistencia para el Desarrollo (CAD), República Eslovaca (USD a precios actuales)",NA,NA,NA,NA,NA,NA,NA,NA,NA,NA,NA,NA
"1160","Ahorro ajustado: agotamiento de minerales (% del INB)",NA,NA,NA,NA,NA,NA,NA,NA,NA,NA,0.00372371337738834,0.00357469989267829
"1161","Services, value added per worker (constant 2010 US$)",NA,NA,NA,NA,NA,NA,NA,NA,NA,NA,NA,NA
"1162","Industrialización, valor agregado (US$ a precios constantes de 2010)",883436236.301086,917200493.967361,988068331.486684,1063203080.68911,1236847834.40137,1432383700.22694,1467698277.64499,1542102691.53068,1564427736.93742,1701227759.77014,1973943110.38963,2020942384.65623
"1163","Balanza comercial de bienes y servicios (UMN a precios actuales)",-14074191.786211,-19189461.109514,-8390000.08483601,-13195609.400773,-27912872.995076,-31275000,-15265000,-49118000,-74229000,-111966000,-102108000,-168194000
"1164","Cambios en inventarios (US$ a precios actuales)",277627195.846463,232423790.066581,194670829.23831,236081681.098221,311639163.8481,327059779.375842,269870365.058194,242662322.610967,89510907.9488344,256700051.736801,109131313.186289,104338015.471096
"1165","Gasto nacional bruto (UMN a precios constantes)",9006659321.02542,9458587275.57196,9722604352.49387,9955912418.29708,10781491781.297,11090461000,11075693000,11836381000,12273708000,12909843000,13771409000,14938969000
"1166","Gasto de consumo final de los hogares (UMN a precios constantes)",5113819473.78751,5384274934.24926,5749304756.98569,5915830477.60963,6423912528.1752,6586526000,6632800000,6853378000,7179543000,7570704000,8225326000,8652315000
"1167","Military expenditure (current USD)",22400000,18700000,18300000,17100000,20600000,23800000,22900000,25300000,29300000,39700000,30700000,29700000
"1168","Suscripciones a banda ancha fija (por cada 100 personas)",NA,NA,NA,NA,NA,NA,NA,NA,NA,NA,NA,NA
"1169","Evaluación de los datos fuente de la capacidad estadística (escala 0 - 100)",NA,NA,NA,NA,NA,NA,NA,NA,NA,NA,NA,NA
"1170","Calificación de formación de recursos humanos de las Evaluaciones de las políticas e instituciones nacionales: CPIA (1=bajo a 6=alto)",NA,NA,NA,NA,NA,NA,NA,NA,NA,NA,NA,NA
"1171","Artículos en publicaciones científicas y técnicas",NA,NA,NA,NA,NA,NA,NA,NA,NA,NA,NA,NA
"1172","Otros impuestos que pagan las empresas (% de las ganancias comerciales)",NA,NA,NA,NA,NA,NA,NA,NA,NA,NA,NA,NA
"1173","Tiempo necesario para hacer cumplir un contrato (días)",NA,NA,NA,NA,NA,NA,NA,NA,NA,NA,NA,NA
"1174","Porcentaje de empresas con manager mujer (promedio entre empresas que reportan)",NA,NA,NA,NA,NA,NA,NA,NA,NA,NA,NA,NA
"1175","Tiempo promedio para que las exportaciones pasen por aduana (días)",NA,NA,NA,NA,NA,NA,NA,NA,NA,NA,NA,NA
"1176","Índice de Capital Humano, femenino (escala de 0 a 1)",NA,NA,NA,NA,NA,NA,NA,NA,NA,NA,NA,NA
"1177","Impuestos sobre la renta, las utilidades y las ganancias de capital (% del total de impuestos)",NA,NA,NA,NA,NA,NA,NA,NA,NA,NA,NA,NA
"1178","Recaudación, excluidas las donaciones (% del PIB)",NA,NA,NA,NA,NA,NA,NA,NA,NA,NA,NA,NA
"1179","Gasto en investigación y desarrollo (% del PIB)",NA,NA,NA,NA,NA,NA,NA,NA,NA,NA,NA,NA
"1180","Diferencial de tasas de interés (tasa activa menos tasa pasiva, %)",NA,NA,NA,NA,NA,NA,NA,NA,NA,NA,NA,NA
"1181","Total de reservas menos oro (US$ a precios actuales)",20750000,19100000,24200000,32900000,40400000,34800000,50100000,5.2e+07,31100000,42900000,55220000,37137153.2529582
"1182","Recursos de agua dulce  internos renovables, total (billones de metros cúbicos)",NA,NA,442.4,NA,NA,NA,NA,442.4,NA,NA,NA,NA
"1183","Población de la ciudad con más habitantes",456225,482874,511121,536214,559197,583097,608054,634080,661257,689520,719032,749808
"1184","Puntuación del progreso en la reducción de los riesgos de desastres (escala de 1 a 5; 5= óptima)",NA,NA,NA,NA,NA,NA,NA,NA,NA,NA,NA,NA
"1185","Emisiones de metano (kt de equivalente de CO2)",NA,NA,NA,NA,NA,NA,NA,NA,NA,NA,6620.78,6037.87
"1186","Emisiones de CO2 del consumo de combustible líquido (% del total)",1664.818,1536.473,1459.466,1668.485,2002.182,2115.859,2233.203,2398.218,2867.594,2970.27,3472.649,3670.667
"1187","Producción de electricidad a partir de fuentes renovables, excluida la hidroeléctrica (% del total)",NA,NA,NA,NA,NA,NA,NA,NA,NA,NA,NA,0
"1188","PGP, multilateral (TSD, US$)",NA,NA,NA,NA,NA,NA,NA,NA,NA,NA,7680000,8995000
"1189","Ayuda oficial neta recibida (US$ constantes de 2014)",NA,NA,NA,NA,NA,NA,NA,NA,NA,NA,NA,NA
"1190","Flujos oficiales netos procedentes de organismos de las Naciones Unidas, ONUSIDA (US$ a precios actuales)",NA,NA,NA,NA,NA,NA,NA,NA,NA,NA,NA,NA
"1191","FMI, en condiciones no concesionarias (FLN, US$)",NA,NA,NA,NA,NA,NA,NA,NA,NA,NA,3500000,-8274956.3
"1192","Deuda a corto plazo (% de las exportaciones de bienes, servicios e ingresos primario)",NA,NA,NA,NA,NA,NA,NA,NA,NA,NA,NA,NA
"1193","Flujos de ayuda bilateral neta de donantes del CAD, Suecia (US$ a precios actuales)",NA,NA,NA,NA,NA,NA,NA,NA,NA,NA,NA,NA
"1194","Flujos de ayuda bilateral neta de donantes del CAD, Reino Unido (US$ a precios actuales)",NA,NA,NA,NA,NA,NA,319999.992847443,409999.996423721,519999.980926514,219999.998807907,250000,379999.995231628
"1195","Compañías nacionales que cotizan en Bolsa, total",NA,NA,NA,NA,NA,NA,NA,NA,NA,NA,NA,NA
"1196","Exportaciones de bienes (balanza de pagos, US$ a precios actuales)",NA,NA,NA,NA,NA,NA,NA,NA,NA,NA,NA,NA
"1197","Servicios de viaje (% de las exportaciones de servicios comerciales)",NA,NA,NA,NA,NA,NA,NA,NA,NA,NA,NA,NA
"1198","Mercaderías exportadas hacia economías en desarrollo fuera de la región (% del total de mercaderías exportadas)",0.214362272240086,0.103626943005181,0.342465753424658,0.0770416024653313,0.0771010023130301,0.287944229749185,3.47122817062697,6.13574546144601,2.14662636405554,2.12542639727106,0.332857822158821,0.982608294505697
"1199","Servicios de transporte (% de las importaciones de servicios comerciales)",NA,NA,NA,NA,NA,NA,NA,NA,NA,NA,NA,NA
"1200","Importaciones de mercadería desde economías del mundo árabe (% del total de importaciones de mercadería)",NA,NA,NA,NA,NA,0.0423242033980289,0.0172294968986906,0.00933619643357296,0.00782840144042586,0.0991858494854734,0.00730353491089687,0.0527518902760682
"1201","Cobertura obligatoria, productos primarios (%)",NA,NA,NA,NA,NA,NA,NA,NA,NA,NA,NA,NA
"1202","Cobertura obligatoria, productos manufacturados (%)",NA,NA,NA,NA,NA,NA,NA,NA,NA,NA,NA,NA
"1203","Crecimiento de la población urbana (% anual)",NA,4.55253876250158,4.55666241084282,4.41049812491383,4.32399490244214,4.32837852331892,4.33579133282935,4.33103377304506,4.32618770499793,4.29919395628201,4.27778748743538,4.24413677984206
"1204","Investigadores dedicados a investigación y desarrollo (por cada millón de personas)",NA,NA,NA,NA,NA,NA,NA,NA,NA,NA,NA,NA
"1205","Población de 65 años de edad y más, mujeres (% del total)",5.18965431497839,5.14944122720288,5.09013648972321,5.02033202911627,4.94980270715748,4.88260908283771,4.83189454443633,4.78155108614708,4.73048145362161,4.67693506417436,4.62032761498869,4.58302866840687
"1206","Población de 30 a 34 años, varones (% de la población masculina)",5.90439125754751,5.89989075226944,5.88543534477564,5.86562132066691,5.84748788894241,5.83360703560083,5.80681130061563,5.78245942717297,5.76583256746595,5.76363295329538,5.7790189778914,5.80086293091166
"1207","Población de 5 a 9 años, varones (% de la población masculina)",14.8399807171206,15.1003120019369,15.1835754674211,15.1000132794031,14.9288505989971,14.772995842897,14.7346405093531,14.7248887436832,14.7338958977358,14.7355027096081,14.6979387837479,14.70230413454
"1208","Supervivencia hasta los 65 años, mujeres (% de la cohorte)",52.1477346,53.0322378,53.916741,54.6567516,55.3967622,56.1367728,56.8767834,57.616794,58.4543868,59.2919796,60.1295724,60.9671652
"1209","Prevalence of severe food insecurity in the population (%)",NA,NA,NA,NA,NA,NA,NA,NA,NA,NA,NA,NA
"1210","Desempleo, mujeres (% de la población activa femenina) (estimación modelado OIT)",NA,NA,NA,NA,NA,NA,NA,NA,NA,NA,NA,NA
"1211","Desempleo, varones jóvenes (% de la población activa masculina entre 15 y 24 años de edad) (estimación modelado OIT)",NA,NA,NA,NA,NA,NA,NA,NA,NA,NA,NA,NA
"1212","Proporcin de tasas de participacin laboral femenina y masculina (%) (estimación modelado OIT)",NA,NA,NA,NA,NA,NA,NA,NA,NA,NA,NA,NA
"1213","Tasa de participación en la fuerza laboral, de 15 a 24 años, varones (%) (estimación nacional)",NA,NA,86.2399978637695,NA,NA,NA,NA,NA,NA,NA,NA,NA
"1214","Niños económicamente activos, varones (% de niños entre los 7 y 14 años de edad)",NA,NA,NA,NA,NA,NA,NA,NA,NA,NA,NA,NA
