"699","Firms experiencing electrical outages (% of firms)",NA,NA,NA,NA,NA,NA,NA,NA,NA,NA,NA,NA
"700","Índice de Capital Humano, masculino, límite inferior (escala de 0 a 1)",NA,NA,NA,NA,NA,NA,NA,NA,NA,NA,NA,NA
"701","Gasto en bienes y servicios (UMN a precios actuales)",NA,NA,NA,NA,NA,NA,NA,NA,NA,NA,NA,NA
"702","Impuestos sobre bienes y servicios (UMN a precios actuales)",NA,NA,NA,NA,NA,NA,NA,NA,NA,NA,NA,NA
"703","Deuda del gobierno central, total (UMN a precios actuales)",NA,NA,NA,NA,NA,NA,NA,NA,NA,NA,NA,NA
"704","Créditos al gobierno central, etc. (% del PIB)",0.580138032040187,1.16163851525604,1.27038060795386,0.877447937996822,0.725691546857904,1.52213444743236,1.76453859038713,1.29543986709008,2.53150366616646,3.25552778380541,3.28981675797245,4.06000944474561
"705","Crédito interno neto (UMN a precios actuales)",239666666.666667,219499999.996667,226888888.887778,232944444.443333,255316666.665555,278066666.67,290727777.777778,316726666.666667,400835555.555555,475148888.888889,406534000.005841,461616000.006788
"706","Áreas marinas protegidas (% de las aguas territoriales)",NA,NA,NA,NA,NA,NA,NA,NA,NA,NA,NA,NA
"707","Población en aglomerados urbanos > 1 millón (% de la población total)",17.0696085495721,17.4683344986021,17.8755265167748,18.2005162269604,18.4679615866493,18.7335299144142,19.0009597323565,19.270408049479,19.5446164228929,19.822005992163,20.1076848756775,20.4011641289249
"708","Emisiones de CO2 originadas por edificios residenciales y servicios comerciales y pblicos (% del total de la quema de combustible)",NA,NA,NA,NA,NA,NA,NA,NA,NA,NA,NA,5.15759312320917
"709","Emisiones de óxido nitroso procedentes de la actividad agrícola (% del total)",NA,NA,NA,NA,NA,NA,NA,NA,NA,NA,85.2970099430606,85.3261972016569
"710","Emisiones de CO2 (kg por PPA del PIB)",NA,NA,NA,NA,NA,NA,NA,NA,NA,NA,NA,NA
"711","PIB por unidad de uso de energía, (PPA a $ constantes de 2011 por kg de equivalente de petróleo)",NA,NA,NA,NA,NA,NA,NA,NA,NA,NA,NA,NA
"712","Nivel de intensidad energética de la energía primaria (megajulios/PIB en USD según la PPA de 2011)",NA,NA,NA,NA,NA,NA,NA,NA,NA,NA,NA,NA
"713","Ayuda Oficial al Desarrollo (ODA) neta recibida (% del INB)",0.327867283031024,0.681907460265511,0.897377787494103,0.898409531932735,0.853854456541372,0.885676497860876,1.0569455110244,1.07605368919266,0.883342497552531,0.570334797217182,0.674127931224579,0.799704787458705
"714","Flujos oficiales netos procedentes de organismos de las Naciones Unidas, PNUD (US$ a precios actuales)",NA,NA,NA,NA,NA,NA,NA,NA,2349999.90463257,1379999.99523163,1289999.96185303,1429999.94754791
"715","PGP, multilateral (FLN, US$ a precios corrientes)",NA,NA,NA,NA,NA,NA,NA,NA,NA,NA,7049000,7034000
"716","PGP, AIF (DPD, US$ a precios actuales)",NA,NA,NA,NA,NA,NA,NA,NA,NA,NA,5841000,7865000
"717","Net ODA provided, to the least developed countries (current US$)",NA,NA,NA,NA,NA,NA,NA,NA,NA,NA,NA,NA
"718","Flujos de ayuda bilateral neta de donantes del CAD, Irlanda(US$ a precios actuales)",NA,NA,NA,NA,NA,NA,NA,NA,NA,NA,NA,NA
"719","Comercio neto de bienes y servicios (balanza de pagos, US$ a precios actuales)",NA,NA,NA,NA,NA,NA,NA,NA,NA,NA,NA,NA
"720","Importaciones de bienes y servicios (balanza de pagos, US$ a precios actuales)",NA,NA,NA,NA,NA,NA,NA,NA,NA,NA,NA,NA
"721","Área selvática (% del área de tierra)",NA,NA,NA,NA,NA,NA,NA,NA,NA,NA,NA,NA
"722","Maquinaria agrícola, tractores",NA,1558,1565,1620,1700,2000,2313,2450,2700,2900,3100,3400
"723","Área de tierra urbana donde la elevación es inferior a 5 metros (% de la superficie total)",NA,NA,NA,NA,NA,NA,NA,NA,NA,NA,NA,NA
"724","Computación, comunicaciones y otros servicios (% de las exportaciones de servicios comerciales)",NA,NA,NA,NA,NA,NA,NA,NA,NA,NA,NA,NA
"725","Exportaciones de productos manufacturados (% de las exportaciones de mercaderías)",NA,NA,1.80358108077059,1.97443871435733,1.66296145070904,2.37345294558481,2.78330887933738,1.90910960391212,1.64245700266447,2.43761629391423,1.75512581772783,2.01856850157401
"726","Mercaderías importadas por la economía informante (US$ actuales)",111100000,109560000,103840000,139370000,160050000,165390000,174120000,214220000,255480000,241970000,273840000,341220000
"727","Importaciones de combustibles (% de importaciones de mercaderías)",NA,NA,2.33393541703997,13.127475870688,3.29665408335305,8.59414482415572,3.12265479569077,10.1294168472388,3.9777199989872,6.91185759547231,6.25020518770806,8.39588971163459
"728","Tasa arancelaria, aplicada, media simple, todos los productos (%)",NA,NA,NA,NA,NA,NA,NA,NA,NA,NA,NA,NA
"729","Turismo internacional, gastos por artículos de viaje (US$ a precios actuales)",NA,NA,NA,NA,NA,NA,NA,NA,NA,NA,NA,NA
"730","Exhaustividad de registro de nacimientos (%)",NA,NA,NA,NA,NA,NA,NA,NA,NA,NA,NA,NA
"731","Proporción de sexos al nacer (mujeres cada 1000 hombres)",NA,NA,1.05,NA,NA,NA,NA,1.05,NA,NA,NA,NA
"732","Población de 50 a 64 años, mujeres (% de la población femenina)",2.39915888167174,2.36473674974426,2.33682725382843,2.31323867981404,2.29168821556264,2.27046099855949,2.2317877400777,2.19451933012752,2.16302557886671,2.14309576894301,2.13689283604857,2.12831361291123
"733","Población de 20 a 24 años, mujeres (% de la población femenina)",7.99674150266722,8.03357344941084,8.08966411333704,8.14559755934727,8.1751169146412,8.16593914835832,8.09529503775661,7.98641378076166,7.88856399553858,7.86973263321429,7.96265566344434,8.13135415279999
"734","Población entre 0 y 14 años de edad, hombres",997885,1032839,1071385,1111720,1150859,1187388,1226135,1262101,1296100,1329719,1363739,1401271
"735","Tasa de mortalidad infantil, varones (cada 1000 nacimientos vivos)",130,126.6,123.3,120.2,117.5,114.8,112.5,110.5,108.6,106.8,104.8,102.5
"736","Volúmenes internacionales de migrantes, total",24061,NA,NA,NA,NA,32827,NA,NA,NA,NA,44787,NA
"737","Personas desempleadas con educación intermedia (% del desempleo total)",NA,NA,NA,NA,NA,NA,NA,NA,NA,NA,NA,NA
"738","Población activa, mujeres (% de la población activa total)",NA,NA,NA,NA,NA,NA,NA,NA,NA,NA,NA,NA
"739","Fuerza laboral con educación básica, varones (% de la fuerza laboral masculina)",NA,NA,NA,NA,NA,NA,NA,NA,NA,NA,NA,NA
"740","Horas de trabajo promedio de niños, solo trabajo, de 7 a 14 años (horas por semana)",NA,NA,NA,NA,NA,NA,NA,NA,NA,NA,NA,NA
"741","Empleo infantil en servicios (% para cada edad de niños entre 7 y 14 años)",NA,NA,NA,NA,NA,NA,NA,NA,NA,NA,NA,NA
"742","Trabajadores familiares que contribuyen, total (% del empleo total)",NA,NA,NA,NA,NA,NA,NA,NA,NA,NA,NA,NA
"743","Relación entre empleo y población, mayores de 15 años, mujeres (%) (estimación modelado OIT)",NA,NA,NA,NA,NA,NA,NA,NA,NA,NA,NA,NA
"744","Empleados en agricultura, hombres (% del empleo masculino)",NA,NA,NA,NA,NA,NA,NA,NA,NA,NA,NA,NA
"745","Multidimensional poverty intensity (average share of deprivations experienced by the poor)",NA,NA,NA,NA,NA,NA,NA,NA,NA,NA,NA,NA
"746","Participación en el ingreso del cuarto quintilo (20%) de la población en orden decreciente de remuneraciones",NA,NA,NA,NA,NA,NA,NA,NA,NA,NA,NA,NA
"747","External health expenditure (% of current health expenditure)",NA,NA,NA,NA,NA,NA,NA,NA,NA,NA,NA,NA
"748","Number of people pushed below the $1.90 ($ 2011 PPP) poverty line by out-of-pocket health care expenditure",NA,NA,NA,NA,NA,NA,NA,NA,NA,NA,NA,NA
"749","Prevalencia de desnutrición, altura para la edad (% de niños menores de cinco años)",NA,NA,NA,NA,NA,NA,NA,NA,NA,NA,NA,NA
"750","Personas que practican la defecación al aire libre, sector rural (% de la población rural)",NA,NA,NA,NA,NA,NA,NA,NA,NA,NA,NA,NA
"751","People using at least basic sanitation services, rural (% of rural population)",NA,NA,NA,NA,NA,NA,NA,NA,NA,NA,NA,NA
"752","Niños con fiebre que reciben medicamentos contra el paludismo (% de niños menores de cinco años con fiebre)",NA,NA,NA,NA,NA,NA,NA,NA,NA,NA,NA,NA
"753","Adultos (de 15 años en adelante) y niños (de 0 a 14 años) recientemente infectados por el VIH",NA,NA,NA,NA,NA,NA,NA,NA,NA,NA,NA,NA
"754","Mortality from CVD, cancer, diabetes or CRD between exact ages 30 and 70, male (%)",NA,NA,NA,NA,NA,NA,NA,NA,NA,NA,NA,NA
"755","Causa de muerte, por enfermedades transmisibles y condiciones maternales, prenatales y en materia de nutrición (% del total)",NA,NA,NA,NA,NA,NA,NA,NA,NA,NA,NA,NA
"756","Mujeres que creen que está justificado que un marido golpee a su esposa cuando sale sin avisarle (%)",NA,NA,NA,NA,NA,NA,NA,NA,NA,NA,NA,NA
"757","Porcentaje del gasto público en educación primaria (% del gasto público en educación)",NA,NA,NA,NA,NA,NA,NA,NA,NA,NA,41.72035,45.85395
"758","Nivel de instrucción, al menos nivel de maestría o equivalente, población de más de 25 años, mujeres (%) (acumulativo)",NA,NA,NA,NA,NA,NA,NA,NA,NA,NA,NA,NA
"759","Maestros capacitados en el ciclo superior de la educación de nivel secundario, mujeres (% de maestras mujeres)",NA,NA,NA,NA,NA,NA,NA,NA,NA,NA,NA,NA
"760","Educación de nivel secundario, alumnos en programas vocacionales (% de mujeres)",NA,NA,NA,NA,NA,NA,NA,NA,NA,NA,NA,56.94327
"761","Nivel de instrucción, al menos ciclo inferior de la escuela secundaria completo, población de más de 25 años, total (%) (acumulativo)",NA,NA,NA,NA,NA,NA,NA,NA,NA,NA,NA,NA
"762","Educación de nivel primario, maestras (% de mujeres)",NA,NA,NA,NA,NA,NA,NA,NA,NA,NA,NA,63.5085906982422
"763","Alumnos de mayor edad, nivel primario, varones (% de matrícula de varones)",NA,NA,NA,NA,NA,NA,NA,NA,NA,NA,NA,17.92898
"764","Educación de nivel primario, alumnos",NA,NA,NA,NA,NA,NA,NA,NA,NA,NA,NA,984000
"765","Educación preescolar, duración (años)",NA,NA,NA,NA,NA,NA,NA,NA,NA,NA,NA,NA
"766","Cobertura de los programas de seguro social en el tercer quintil (% de la población)",NA,NA,NA,NA,NA,NA,NA,NA,NA,NA,NA,NA
"767","Cobertura de los beneficios por desempleo y los ALMP en el tercer quintil (% de la población)",NA,NA,NA,NA,NA,NA,NA,NA,NA,NA,NA,NA
"768","Transferencias corrientes netas del extranjero (UMN a precios actuales)",7200000,7100000,9300000,6700000,11900000,9300000,9400000,12700000,13200000,12300000,17200000,16100000
"769","INB per cápita (US$ constantes del año 2010)",2207.53117744795,2247.88142807396,2292.8351993639,2289.74957737514,2393.02125031104,2395.49079922417,2318.64712151759,2357.10605030448,2330.58876196046,2373.06342637848,2460.21584327012,2532.94720763515
"770","Rentas totales de los recursos naturales (% del PIB)",NA,NA,NA,NA,NA,NA,NA,NA,NA,NA,0.612496801061449,0.734455023426005
"771","PIB (UMN a precios actuales)",1723727707.49622,1606925598.75671,1517480482.39083,1823470009.68825,2243071157.1958,2385904000,2428145000,2552372000,2580943000,3110675000,2861132000,2752900000
"772","Ahorro neto ajustado, excluido el daño por emisión de partículas (% del ingreso nacional bruto: INB)",NA,NA,NA,NA,NA,NA,NA,NA,NA,NA,NA,NA
"773","Ahorro ajustado: agotamiento de fuentes de energía (% del INB)",NA,NA,NA,NA,NA,NA,NA,NA,NA,NA,0.00175045823599608,0.00252231480077776
"774","Servicios, valor agregado (UMN actuales)",706252090.169889,660971972.063496,608238636.559669,727436013.139963,900018187.46684,980207000,1030538000,1075055000,1050325000,1360759000,1191732000,1141328000
"775","Industrialización, valor agregado (UMN a precios constantes)",735951341.795104,764078839.528559,823115675.430644,885707085.222122,1030362787.85131,1193255000,1222674000,1284657000,1303255000,1417217000,1644404000,1683557000
"776","Internally displaced persons, total displaced by conflict and violence (number of people)",NA,NA,NA,NA,NA,NA,NA,NA,NA,NA,NA,NA
"777","Mercaderías exportadas hacia economías en desarrollo en Oriente Medio y Norte de África (% del total de mercaderías exportadas)",NA,0.103626943005181,0.171232876712329,0.0770416024653313,0.0771010023130301,0.106084716223384,0.0071571714858288,4.05465241318236,0.00512321327936882,0.131199160325374,0.175939134569662,0.49822392397472
"778","Índice del volumen de exportaciones (2000 = 100)",NA,NA,NA,NA,NA,NA,NA,NA,NA,NA,NA,NA
"779","Mercaderías importadas desde economías en desarrollo de Asia oriental y el Pacífico (% del total de mercaderías importadas)",NA,NA,0.105932203389831,0.15785319652723,0.0687285223367698,0.435334663522583,0.41925109120147,0.303426384091121,0.289650853295757,0.351283216927718,0.241016652059597,0.641814665025497
"780","Tasa arancelaria, nación más favorecida, media simple, productos primarios (%)",NA,NA,NA,NA,NA,NA,NA,NA,NA,NA,NA,NA
"781","Tasa arancelaria, nación más favorecida, media simple, productos manufacturados (%)",NA,NA,NA,NA,NA,NA,NA,NA,NA,NA,NA,NA
"782","Turismo internacional, número de arribos",NA,NA,NA,NA,NA,NA,NA,NA,NA,NA,NA,NA
"783","Población, mujeres (% del total)",50.0084513403077,49.9846390037517,49.9614904285417,49.9388663264896,49.9164286017172,49.8939545917414,49.871514048816,49.8493798485723,49.8283282641645,49.8094945048384,49.7933477499743,49.7801252708918
"784","Población de 65 años de edad y más (% del total)",4.69902497234612,4.67139420628937,4.62542530453603,4.5682893425037,4.50910057492814,4.45127810438528,4.41139810890869,4.370206395238,4.32733864656091,4.28137892009098,4.23246145897041,4.20370463445859
"785","Población de 40 a 44 años, varones (% de la población masculina)",4.23105115906394,4.18435062618541,4.15126188005646,4.12977326932849,4.11715201704622,4.11029129406051,4.0982410353171,4.09449067397891,4.09631130420252,4.09984741028384,4.10320192437066,4.09842779814289
"786","Población de 15 a 19 años, varones (% de la población masculina)",9.76114323701432,9.6936187177208,9.56068464363882,9.4277707434165,9.3882793890359,9.48457327755008,9.66168867850985,9.9558489316919,10.2970869189852,10.5873605696683,10.775819350689,10.8588607233843
"787","Women who were first married by age 15 (% of women ages 20-24)",NA,NA,NA,NA,NA,NA,NA,NA,NA,NA,NA,NA
"788","Tasa de mortalidad, adultos, varones (por cada 1.000 varones adultos)",296.714,288.06,279.405,276.968,274.531,272.094,269.657,267.22,264.745,262.27,259.796,257.321
"789","Desempleo, total (% de la población activa total) (estimación modelado OIT)",NA,NA,NA,NA,NA,NA,NA,NA,NA,NA,NA,NA
"790","Personas desempleadas con educación avanzada, varones",NA,NA,NA,NA,NA,NA,NA,NA,NA,NA,NA,NA
"791","Tasa de población activa, total (% de la población total mayor de 15 años) (estimación modelado OIT)",NA,NA,NA,NA,NA,NA,NA,NA,NA,NA,NA,NA
"792","Tasa de participación en la fuerza laboral, mujeres (% de la población femenina entre 15-64 años) (estimación modelado OIT)",NA,NA,NA,NA,NA,NA,NA,NA,NA,NA,NA,NA
"793","Niños económicamente activos, que estudian y trabajan, varones (% para cada edad de niños entre los 7 y 14 años)",NA,NA,NA,NA,NA,NA,NA,NA,NA,NA,NA,NA
"794","Empleo infantil en la industria, varones (% para cada edad de niños entre 7 y 14 años)",NA,NA,NA,NA,NA,NA,NA,NA,NA,NA,NA,NA
"795","Trabajadores asalariados (empleados), varones (% del empleo masculino)",NA,NA,NA,NA,NA,NA,NA,NA,NA,NA,NA,NA
"796","Empleadores, varones (% del empleo masculino)",NA,NA,NA,NA,NA,NA,NA,NA,NA,NA,NA,NA
"797","Tasa de crecimiento promedio anualizada en el consumo medio o ingresos reales per cápita según encuestas, 40 % más pobre de la población (%)",NA,NA,NA,NA,NA,NA,NA,NA,NA,NA,NA,NA
"798","Poverty headcount ratio at $3.20 a day (2011 PPP) (% of population)",NA,NA,NA,NA,NA,NA,NA,NA,NA,NA,NA,NA
"799","Out-of-pocket expenditure per capita (current US$)",NA,NA,NA,NA,NA,NA,NA,NA,NA,NA,NA,NA
"800","Number of people spending more than 25% of household consumption or income on out-of-pocket health care expenditure",NA,NA,NA,NA,NA,NA,NA,NA,NA,NA,NA,NA
"801","Prevalencia de emaciación grave, peso en relación con estatura, mujeres (% de niños menores de 5 años)",NA,NA,NA,NA,NA,NA,NA,NA,NA,NA,NA,NA
"802","Mortality rate attributed to unintentional poisoning, female (per 100,000 female population)",NA,NA,NA,NA,NA,NA,NA,NA,NA,NA,NA,NA
"803","People with basic handwashing facilities including soap and water, urban (% of urban population)",NA,NA,NA,NA,NA,NA,NA,NA,NA,NA,NA,NA
"804","Riesgo de contraer gastos empobrecedores relacionados con la atención quirúrgica (% de personas en riesgo)",NA,NA,NA,NA,NA,NA,NA,NA,NA,NA,NA,NA
"805","Camas hospitalarias (por cada 1.000 personas)",1.87069153785706,NA,NA,NA,NA,NA,NA,NA,NA,NA,2.34910011291504,NA
"806","People using safely managed drinking water services (% of population)",NA,NA,NA,NA,NA,NA,NA,NA,NA,NA,NA,NA
"807","Probability of dying among youth ages 20-24 years (per 1,000)",NA,NA,NA,NA,NA,NA,NA,NA,NA,NA,NA,NA
"808","Prevalencia de anemia entre mujeres no embarazadas (% de mujeres entre 15-49 años)",NA,NA,NA,NA,NA,NA,NA,NA,NA,NA,NA,NA
"809","Proporción de escaños ocupados por mujeres en los parlamentos nacionales (%)",NA,NA,NA,NA,NA,NA,NA,NA,NA,NA,NA,NA
"810","Inscripción escolar, nivel terciario, varones (% bruto)",NA,NA,NA,NA,NA,NA,NA,NA,NA,NA,NA,9.80554008483887
"811","Adolescentes que no asisten a la escuela (% de adolescentes en edad de asistir al ciclo inferior de la escuela secundaria)",NA,NA,NA,NA,NA,NA,NA,NA,NA,NA,NA,NA
"812","Transición a la escuela secundaria, varones (%)",NA,NA,NA,NA,NA,NA,NA,NA,NA,NA,NA,78.47928
"813","Educación de nivel secundario, alumnos (% de mujeres)",NA,NA,NA,NA,NA,NA,NA,NA,NA,NA,NA,45.44888
"814","Niños que no asisten a la escuela (% de niños y niñas en edad de asistir a la escuela primaria)",NA,NA,NA,NA,NA,NA,NA,NA,NA,NA,NA,20.4613094329834
"815","Repetidores, escuela primaria, mujeres (% de mujeres inscriptas)",NA,NA,NA,NA,NA,NA,NA,NA,NA,NA,NA,11.95347
"816","Inscripción escolar, nivel primario (% neto)",NA,NA,NA,NA,NA,NA,NA,NA,NA,NA,NA,79.53869
"817","Tasa de finalización de la educación de nivel primario, mujeres (% del grupo etario correspondiente)",NA,NA,NA,NA,NA,NA,NA,NA,NA,NA,NA,53.5948486328125
"818","Tasa de alfabetización, varones adultos (% de varones de 15 años o más)",NA,NA,NA,NA,NA,NA,NA,NA,NA,NA,NA,NA
"819","Cobertura de los programas de medidas de protección social en el cuarto quintil (% de la población)",NA,NA,NA,NA,NA,NA,NA,NA,NA,NA,NA,NA
"820","Incidencia de los beneficios de los programas de trabajo y protección social (SPL) para el quintil más pobre (% del total de beneficios de los SPL)",NA,NA,NA,NA,NA,NA,NA,NA,NA,NA,NA,NA
"821","Ingreso neto del extranjero (US$ a precios actuales)",-25955602.8117883,-27809693.6487302,-23854334.3509404,-17818741.2461202,-18943280.283337,-25011989.7474053,-25212085.6653846,-24911941.7884157,-27112996.8861874,-28013428.517094,-29214004.0249694,-35717121.3592948
"822","INB (US$ constantes del año 2010)",10030284354.9102,10506984430.4233,11026705333.6161,11331938601.9355,12189700867.9819,12561898654.8431,12519354278.1587,13105537924.9655,13343690402.4654,13990079812.7786,14931974993.9634,15824379978.0296
"823","Balanza comercial de bienes y servicios (% del PIB)",-0.816497392540862,-1.19417234527603,-0.552890147991712,-0.723653766207484,-1.2444042582212,-1.31082390573971,-0.628669210446658,-1.92440600351359,-2.87604181882358,-3.59941170324769,-3.56879724528613,-6.10970249555015
"824","Cambios en inventarios (UMN a precios constantes)",NA,NA,NA,NA,NA,433141000,326686000,276198000,103067000,125797000,292490000,76266000
"825","Exportaciones de bienes y servicios (US$ a precios actuales)",197583745.854204,157101028.714894,155487287.042826,168447595.433591,199730280.617423,214348750.216904,254730107.424295,258096721.244296,285128679.283701,264625851.047958,270255549.700304,291407689.18989
"826","Gasto de consumo final de los hogares por crecimiento per cápita (% anual)",NA,2.34898618344515,3.78148077763791,-0.00987903105607302,5.50028440832718,-0.403860077107282,-2.19658977762313,0.341208380847988,1.73198878183835,2.40918936597809,5.53187546394311,2.19336059098691
"827","Gasto militar (% del PIB)",2.37623678350892,2.04676698378785,2.04545378336297,1.76521231065259,1.90995401275775,2.0695652173913,1.8242215194411,1.80442333340465,1.92397349775755,2.37061630052488,1.83368971819713,1.85402516979624
"828","Servidores de Internet seguros (por cada millón de personas)",NA,NA,NA,NA,NA,NA,NA,NA,NA,NA,NA,NA
"829","Calidad de infraestructura portuaria, WEF (1= muy precaria a 7= buen desarrollo y eficiencia conforme a estándares internacionales)",NA,NA,NA,NA,NA,NA,NA,NA,NA,NA,NA,NA
"830","Calificación de gestión macroeconómica de la CPIA (1=bajo a 6=alto)",NA,NA,NA,NA,NA,NA,NA,NA,NA,NA,NA,NA
"831","Solicitudes de patentes, residentes",NA,NA,NA,NA,NA,NA,NA,NA,NA,NA,NA,NA
"832","Impuesto sobre utilidades (% de utilidades comerciales)",NA,NA,NA,NA,NA,NA,NA,NA,NA,NA,NA,NA
"833","Procedimientos para registrar una propiedad (número)",NA,NA,NA,NA,NA,NA,NA,NA,NA,NA,NA,NA
"834","Empresas formalmente registradas al inicio de las operaciones (% de empresas)",NA,NA,NA,NA,NA,NA,NA,NA,NA,NA,NA,NA
"835","Cortes de energía en empresas mensuales (cantidad)",NA,NA,NA,NA,NA,NA,NA,NA,NA,NA,NA,NA
"836","Índice de Capital Humano, femenino, límite inferior (escala de 0 a 1)",NA,NA,NA,NA,NA,NA,NA,NA,NA,NA,NA,NA
"837","Compensación de empleados (% del gasto)",NA,NA,NA,NA,NA,NA,NA,NA,NA,NA,NA,NA
"838","Impuestos a las exportaciones (% de la recaudación impositiva)",NA,NA,NA,NA,NA,NA,NA,NA,NA,NA,NA,NA
"839","Adquisición neta de activos financieros (% del PIB)",NA,NA,NA,NA,NA,NA,NA,NA,NA,NA,NA,NA
"840","Prima de riesgo por préstamo (tasa de la prima menos tasa de los bonos del tesoro, %)",NA,NA,NA,NA,NA,NA,NA,NA,NA,NA,NA,NA
"841","Créditos a otros sectores de la economía nacional (crecimiento anual como % de la masa monetaria)",NA,NA,NA,NA,NA,NA,NA,NA,NA,NA,NA,NA
"842","Áreas terrestres protegidas (% del área total de la tierra)",NA,NA,NA,NA,NA,NA,NA,NA,NA,NA,NA,NA
"843","Población en aglomerados urbanos de más de 1 millón de personas",775586,816500,859670,900741,940731,982382,1025942,1071437,1119019,1168580,1220411,1274546
"844","Sequías, inundaciones, temperaturas extremas (% de la población, promedio de 1990-2009)",NA,NA,NA,NA,NA,NA,NA,NA,NA,NA,NA,NA
"845","Emisiones agrícolas de óxido nitroso (miles de toneladas métricas de equivalente de CO2)",NA,NA,NA,NA,NA,NA,NA,NA,NA,0,1703.845219,1605.966594
"846","Emisiones de CO2 (toneladas métricas per cápita)",0.38819468684538,0.352251265036888,0.325586100476981,0.363070334003774,0.421133978319756,0.434251904613617,0.448236866835006,0.466288382111405,0.544401767613741,0.609573585495186,0.705683088343843,0.676180783805406
"847","PIB por unidad de uso de energía, (PPA a $ por kg de equivalente de petróleo)",NA,NA,NA,NA,NA,NA,NA,NA,NA,NA,NA,NA
"848","Acceso a tecnologías y combustibles limpios para cocinar (% de la población)",NA,NA,NA,NA,NA,NA,NA,NA,NA,NA,NA,NA
"849","AOD neta recibida (% de formación bruta de capital)",1.27390456233838,2.63949712579398,3.72193141663459,3.71916320847218,3.43646289024894,3.59696276683657,4.67320099615536,4.65224918650279,4.7613096904974,2.51378932236898,3.41130283225439,3.52399353973253
"850","Flujos oficiales netos procedentes de organismos de las Naciones Unidas, ACNUR (US$ a precios actuales)",NA,NA,NA,NA,NA,NA,NA,NA,NA,NA,NA,NA
"851","Flujos financieros netos, AIF (NFL, US$ a precios actuales)",NA,NA,NA,NA,NA,NA,NA,NA,NA,NA,2143000,2024000
"852","PGP, BIRF (DPD, US$ a precios actuales)",NA,NA,NA,NA,NA,NA,NA,NA,NA,NA,33624000,31952000
"853","Flujos de ayuda bilateral neta de donantes del CAD, Estados Unidos (US$ a precios actuales)",6e+06,1.1e+07,1.2e+07,1.4e+07,1.7e+07,17319999.6948242,22049999.2370605,22899999.6185303,12649999.6185303,1e+07,9e+06,1e+07
"854","Net bilateral aid flows from DAC donors, Hungary (current US$)",NA,NA,NA,NA,NA,NA,NA,NA,NA,NA,NA,NA
"855","Acciones negociadas, valor total (% del PIB)",NA,NA,NA,NA,NA,NA,NA,NA,NA,NA,NA,NA
"856","Cargos por el uso de propiedad intelectual, recibos (balanza de pagos, US$ a precios actuales)",NA,NA,NA,NA,NA,NA,NA,NA,NA,NA,NA,NA
"857","Flujos de ayuda bilateral neta de donantes del CAD, Finlandia (US$ a precios actuales)",NA,NA,NA,NA,NA,NA,NA,NA,NA,NA,NA,NA
"858","Capitalización en el mercado de empresas nacionales que cotizan en bolsa (USD a precios actuales)",NA,NA,NA,NA,NA,NA,NA,NA,NA,NA,NA,NA
"859","Exportaciones de bienes y servicios (balanza de pagos, US$ a precios actuales)",NA,NA,NA,NA,NA,NA,NA,NA,NA,NA,NA,NA
"860","Cuenta financiera neta (BDP, USD a precios actuales)",NA,NA,NA,NA,NA,NA,NA,NA,NA,NA,NA,NA
"861","Comunicaciones, computadoras, etc. (% de importaciones de servicios, balanza de pagos)",NA,NA,NA,NA,NA,NA,NA,NA,NA,NA,NA,NA
"862","Superficie del terreno donde la elevación es inferior a 5 metros (% de la superficie total)",NA,NA,NA,NA,NA,NA,NA,NA,NA,NA,NA,NA
"863","Formación bruta de capital (US$ a precios constantes de 2010)",4029454716.17639,4162569547.14557,3983734424.68849,4107543355.62031,4372559204.51031,4476947126.66852,4375965053.03126,5005537337.26469,5046230142.72154,5223843059.93633,5435136809.99303,6408165503.15432
"864","Exportaciones de bienes y servicios (% del crecimiento anual)",NA,-4.06539991162177,21.1116229080301,-8.17697768762667,3.74154355929855,8.62390204950761,3.78176715944613,7.28553494059831,2.65425774537775,-12.1987793043316,0.187616839733479,10.5247241977936
"865","Households and NPISHs final consumption expenditure (% of GDP)",66.119698266601,66.0242253042414,66.4787823374048,66.9508499681242,67.4771405957774,67.5123139908395,69.0945969042211,71.5382397236766,77.3208862032211,72.879391128935,74.3155506282129,75.1983362999019
"866","Gasto de consumo final del gobierno general (US$ a precios actuales)",183549832.294968,166744228.836308,140968902.2007,161370282.580408,206715203.434185,225184944.65507,222321572.068787,191061587.28248,185851089.5783,256317868.53346,277472008.982226,234453387.575868
"867","Plazo de entrega para las importaciones, caso de la mediana (días)",NA,NA,NA,NA,NA,NA,NA,NA,NA,NA,NA,NA
"868","Transporte aéreo, pasajeros transportados",NA,NA,NA,NA,NA,NA,NA,NA,NA,NA,419500,457500
